{
  "allow_sub_majority": false,
  "directory_pinned": false,
  "exit_code": 20,
  "identity_pinned": false,
  "identity_pubkey": "9f6da356d5f4759ce7c426bca96ce2ac4a611c1f872faec81492422892324d1e",
  "min_witnesses_used": null,
  "path": "c2sp/a.json",
  "report": {
    "bindings_asserted": true,
    "bindings_valid": true,
    "checkpoint_signature_valid": true,
    "claimed_tree_size": 7,
    "contradictions": [],
    "externally_anchored": false,
    "failures": [],
    "identity_bound": true,
    "identity_pinned": false,
    "internally_consistent": true,
    "known_heads_unchecked": [],
    "leaf_count": 7,
    "leaves_structurally_valid": true,
    "merkle_continuity_valid": true,
    "quorum": null,
    "split_view_unsafe": false,
    "verdict": "unanchored"
  },
  "strict": true,
  "subject_org": null,
  "threshold_used": 0.66,
  "verdict": "UNANCHORED"
}
