{
  "allow_sub_majority": false,
  "directory_pinned": true,
  "exit_code": 0,
  "identity_pinned": true,
  "identity_pubkey": "504e140aba44481f18e0a4cf0d7c9ce9065443186e939a20d5734f0b1296c7ab",
  "min_witnesses_used": null,
  "path": "c2sp/b.json",
  "report": {
    "bindings_asserted": true,
    "bindings_valid": true,
    "checkpoint_signature_valid": true,
    "claimed_tree_size": 4,
    "contradictions": [],
    "externally_anchored": true,
    "failures": [],
    "identity_bound": true,
    "identity_pinned": true,
    "internally_consistent": true,
    "known_heads_unchecked": [],
    "leaf_count": 4,
    "leaves_structurally_valid": true,
    "merkle_continuity_valid": true,
    "quorum": {
      "compute_diversity_fraction": 1.0,
      "count_gate": "fraction >= 0.66",
      "distinct_compute_providers_in_directory": 2,
      "distinct_compute_providers_represented": 2,
      "distinct_independent_operators": 2,
      "distinct_operators_in_directory": 2,
      "distinct_operators_represented": 2,
      "diversity_fraction": 1.0,
      "independent_operators_represented": [
        "golden org one",
        "golden org two"
      ],
      "meets_count_threshold": true,
      "newest_trusted_witness_ms": 1791783734000,
      "project_operated_receipts": 0,
      "quorum_fraction": 1.0,
      "split_view_resistant": true,
      "total_directory_witnesses": 2,
      "tree_size": 4,
      "valid_receipts": 2
    },
    "split_view_unsafe": false,
    "verdict": "witnessed"
  },
  "strict": true,
  "subject_org": null,
  "threshold_used": 0.66,
  "verdict": "WITNESSED"
}
