{
  "allow_sub_majority": false,
  "directory_pinned": true,
  "exit_code": 0,
  "identity_pinned": false,
  "identity_pubkey": "a33f38a835a2adb85202f1588063bc82c12254c8b0e924b9b9568530d89c1727",
  "min_witnesses_used": null,
  "path": "native/dossier.json",
  "report": {
    "bindings_asserted": true,
    "bindings_valid": true,
    "checkpoint_signature_valid": true,
    "claimed_tree_size": 6,
    "contradictions": [],
    "externally_anchored": true,
    "failures": [],
    "identity_bound": true,
    "identity_pinned": false,
    "internally_consistent": true,
    "known_heads_unchecked": [],
    "leaf_count": 6,
    "leaves_structurally_valid": true,
    "merkle_continuity_valid": true,
    "quorum": {
      "compute_diversity_fraction": 0.75,
      "count_gate": "fraction >= 0.66",
      "distinct_compute_providers_in_directory": 4,
      "distinct_compute_providers_represented": 3,
      "distinct_independent_operators": 2,
      "distinct_operators_in_directory": 4,
      "distinct_operators_represented": 3,
      "diversity_fraction": 0.75,
      "independent_operators_represented": [
        "example-infra-co",
        "example-university"
      ],
      "meets_count_threshold": true,
      "newest_trusted_witness_ms": 1791783733273,
      "project_operated_receipts": 1,
      "quorum_fraction": 0.75,
      "split_view_resistant": true,
      "total_directory_witnesses": 4,
      "tree_size": 6,
      "valid_receipts": 3
    },
    "split_view_unsafe": false,
    "verdict": "witnessed"
  },
  "strict": true,
  "threshold_used": 0.66,
  "verdict": "WITNESSED"
}
